{
  "schema_version": "1.1.0",
  "owner": "coffee-chat",
  "scope": "plugin-package",
  "owned_files": [
    {
      "path": "./.claude-plugin/plugin.json",
      "digest": "sha256:46ae25dc13593d307767810f3991a951d1c1e3979634b9386f97059cc79355ea"
    },
    {
      "path": "./.codex-plugin/plugin.json",
      "digest": "sha256:0f7f2c36aea86eb04ab560c8f9a7f5a1a6cce00be3619ce7d9ffb8f77cd27984"
    },
    {
      "path": "./LICENSE",
      "digest": "sha256:4e877a766f8f5ea05b55cd7447e272c9307e892014c573704a4b9f2c7146a0c0"
    },
    {
      "path": "./skills/apply-perspective/SKILL.md",
      "digest": "sha256:e3ff981a5ad87770ebca575a40d2d4060c9000ae5d64821248476ba3484895d5"
    },
    {
      "path": "./skills/apply-perspective/references/method.md",
      "digest": "sha256:1d4d90fef434ae5ced86a3f12dfda956674b861a40d4cc5d69cb4af2d8d0c0b8"
    },
    {
      "path": "./skills/build-kg/SKILL.md",
      "digest": "sha256:1708f877660b2c64303b32214af863e4b708204b3d6bb6d884be2c6f26d86b71"
    },
    {
      "path": "./skills/build-kg/references/method.md",
      "digest": "sha256:1d4d90fef434ae5ced86a3f12dfda956674b861a40d4cc5d69cb4af2d8d0c0b8"
    },
    {
      "path": "./skills/coffee-chat/SKILL.md",
      "digest": "sha256:da5445fbc387944316c894538ec25787f83b10836b4ea4efb46e9e7de5813f8d"
    },
    {
      "path": "./skills/coffee-chat/references/method.md",
      "digest": "sha256:1d4d90fef434ae5ced86a3f12dfda956674b861a40d4cc5d69cb4af2d8d0c0b8"
    },
    {
      "path": "./skills/create-coffee-chat/SKILL.md",
      "digest": "sha256:3b6b3daffd54b132ca3f3152e69ca351e82618d62ac9d1e2e9d2ec529008604a"
    },
    {
      "path": "./skills/create-coffee-chat/references/engine-release.schema.json",
      "digest": "sha256:8e9a1edbc18c77f2003b73e8037ce07eec96bfa62b7bc0fb1248595bf92772e4"
    },
    {
      "path": "./skills/create-coffee-chat/references/engine-template-surface.schema.json",
      "digest": "sha256:b3b1bb053ffb81db2908a63706110294771439e1c7d774b0bcc5af3e5b379014"
    },
    {
      "path": "./skills/create-coffee-chat/references/method.md",
      "digest": "sha256:1d4d90fef434ae5ced86a3f12dfda956674b861a40d4cc5d69cb4af2d8d0c0b8"
    },
    {
      "path": "./skills/create-coffee-chat/references/release.json",
      "digest": "sha256:2224d0e9e90fd2e38cf2085cf65f3b676809bf407065a1d303067a4012951e38"
    },
    {
      "path": "./skills/update-coffee-chat/SKILL.md",
      "digest": "sha256:a1f3fdf39f7e1221652a995d5cf99e6d61cccb1e5c5b3adde1d743a8537d0560"
    },
    {
      "path": "./skills/update-coffee-chat/references/advisory.json",
      "digest": "sha256:2731ad5249bbf89d0f30b8e5984e268f48bbee31afb1577ffb68e05f16e0cddd"
    },
    {
      "path": "./skills/update-coffee-chat/references/engine-migration-document.schema.json",
      "digest": "sha256:a74716a3d8bd1b0aac8a5fa7ff475208487f575c99b25fd72f3bd20741a26a5a"
    },
    {
      "path": "./skills/update-coffee-chat/references/engine-migration-registry.schema.json",
      "digest": "sha256:f88958aea890636a48053ead87d2b0d94d384020f197275c66e10d84ee46397f"
    },
    {
      "path": "./skills/update-coffee-chat/references/engine-release.schema.json",
      "digest": "sha256:8e9a1edbc18c77f2003b73e8037ce07eec96bfa62b7bc0fb1248595bf92772e4"
    },
    {
      "path": "./skills/update-coffee-chat/references/engine-update-advisory.schema.json",
      "digest": "sha256:adb3dd0de5b638d29bddda4b5fc11e54eada5df716682f9d483ea7943272d029"
    },
    {
      "path": "./skills/update-coffee-chat/references/method.md",
      "digest": "sha256:1d4d90fef434ae5ced86a3f12dfda956674b861a40d4cc5d69cb4af2d8d0c0b8"
    },
    {
      "path": "./skills/update-coffee-chat/references/migration-registry.json",
      "digest": "sha256:92d08686a73e43e1c842a739f2f6d0018fca5995c12a6d55f5f597b31c4954c3"
    },
    {
      "path": "./skills/update-coffee-chat/references/release.json",
      "digest": "sha256:2224d0e9e90fd2e38cf2085cf65f3b676809bf407065a1d303067a4012951e38"
    }
  ]
}
