{
  "schema_version": "1.1.0",
  "owner": "coffee-chat",
  "scope": "repository",
  "owned_files": [
    {
      "path": "./.agents/plugins/marketplace.json",
      "digest": "sha256:e416a10d9708a4ed5915704ede2f7d32f6554ddeb996fffcb70d005de94404be"
    },
    {
      "path": "./.claude-plugin/marketplace.json",
      "digest": "sha256:cd1bc7e1b477195829965e7e8f6f8c3ad18e3432444f08bcd2fa05b00ce01766"
    },
    {
      "path": "./.claude-plugin/plugin.json",
      "digest": "sha256:46ae25dc13593d307767810f3991a951d1c1e3979634b9386f97059cc79355ea"
    },
    {
      "path": "./.codex-plugin/plugin.json",
      "digest": "sha256:0f7f2c36aea86eb04ab560c8f9a7f5a1a6cce00be3619ce7d9ffb8f77cd27984"
    },
    {
      "path": "./AGENTS.md",
      "digest": "sha256:aaaf3985f33ca7cc4d236a82bc3da5c85cb7a6c432a281663e25acc87efa8fe9"
    },
    {
      "path": "./CLAUDE.md",
      "digest": "sha256:336cc4fbf19beaada7ccf9986414fa91851a8d7a07dfb3ccbe800a69eed0ab49"
    },
    {
      "path": "./README.ko.md",
      "digest": "sha256:eae5fd51eea04a0878dbbae4cc117652f05915f44271ce6200c556468073c72b"
    },
    {
      "path": "./README.md",
      "digest": "sha256:1610959378b4bb31a7eb46381efc8242b956aaf7bcf688a8ccab07ebbd70cb36"
    },
    {
      "path": "./plugins/coffee-chat/.claude-plugin/plugin.json",
      "digest": "sha256:46ae25dc13593d307767810f3991a951d1c1e3979634b9386f97059cc79355ea"
    },
    {
      "path": "./plugins/coffee-chat/.codex-plugin/plugin.json",
      "digest": "sha256:0f7f2c36aea86eb04ab560c8f9a7f5a1a6cce00be3619ce7d9ffb8f77cd27984"
    },
    {
      "path": "./plugins/coffee-chat/.coffee-chat-generated.json",
      "digest": "sha256:8556710d7971be5f2474b44ef312956016d45ee43578b65e4a1076b69f217d30"
    },
    {
      "path": "./plugins/coffee-chat/LICENSE",
      "digest": "sha256:4e877a766f8f5ea05b55cd7447e272c9307e892014c573704a4b9f2c7146a0c0"
    },
    {
      "path": "./plugins/coffee-chat/skills/apply-perspective/SKILL.md",
      "digest": "sha256:e3ff981a5ad87770ebca575a40d2d4060c9000ae5d64821248476ba3484895d5"
    },
    {
      "path": "./plugins/coffee-chat/skills/apply-perspective/references/method.md",
      "digest": "sha256:80b3f9ccfda3de337f834c971610ec916c3b5e949623054f36927f67bbabde7f"
    },
    {
      "path": "./plugins/coffee-chat/skills/build-kg/SKILL.md",
      "digest": "sha256:1708f877660b2c64303b32214af863e4b708204b3d6bb6d884be2c6f26d86b71"
    },
    {
      "path": "./plugins/coffee-chat/skills/build-kg/references/method.md",
      "digest": "sha256:80b3f9ccfda3de337f834c971610ec916c3b5e949623054f36927f67bbabde7f"
    },
    {
      "path": "./plugins/coffee-chat/skills/coffee-chat/SKILL.md",
      "digest": "sha256:da5445fbc387944316c894538ec25787f83b10836b4ea4efb46e9e7de5813f8d"
    },
    {
      "path": "./plugins/coffee-chat/skills/coffee-chat/references/method.md",
      "digest": "sha256:80b3f9ccfda3de337f834c971610ec916c3b5e949623054f36927f67bbabde7f"
    },
    {
      "path": "./plugins/coffee-chat/skills/create-coffee-chat/SKILL.md",
      "digest": "sha256:3b6b3daffd54b132ca3f3152e69ca351e82618d62ac9d1e2e9d2ec529008604a"
    },
    {
      "path": "./plugins/coffee-chat/skills/create-coffee-chat/references/engine-release.schema.json",
      "digest": "sha256:8e9a1edbc18c77f2003b73e8037ce07eec96bfa62b7bc0fb1248595bf92772e4"
    },
    {
      "path": "./plugins/coffee-chat/skills/create-coffee-chat/references/engine-template-surface.schema.json",
      "digest": "sha256:b3b1bb053ffb81db2908a63706110294771439e1c7d774b0bcc5af3e5b379014"
    },
    {
      "path": "./plugins/coffee-chat/skills/create-coffee-chat/references/method.md",
      "digest": "sha256:80b3f9ccfda3de337f834c971610ec916c3b5e949623054f36927f67bbabde7f"
    },
    {
      "path": "./plugins/coffee-chat/skills/create-coffee-chat/references/release.json",
      "digest": "sha256:6171dbb9adc06bc901a29132951f5ed899e66ff76c7b0ca4889a229570dbb8d0"
    },
    {
      "path": "./skills/apply-perspective/references/method.md",
      "digest": "sha256:80b3f9ccfda3de337f834c971610ec916c3b5e949623054f36927f67bbabde7f"
    },
    {
      "path": "./skills/build-kg/references/method.md",
      "digest": "sha256:80b3f9ccfda3de337f834c971610ec916c3b5e949623054f36927f67bbabde7f"
    },
    {
      "path": "./skills/coffee-chat/references/method.md",
      "digest": "sha256:80b3f9ccfda3de337f834c971610ec916c3b5e949623054f36927f67bbabde7f"
    },
    {
      "path": "./skills/create-coffee-chat/references/engine-release.schema.json",
      "digest": "sha256:8e9a1edbc18c77f2003b73e8037ce07eec96bfa62b7bc0fb1248595bf92772e4"
    },
    {
      "path": "./skills/create-coffee-chat/references/engine-template-surface.schema.json",
      "digest": "sha256:b3b1bb053ffb81db2908a63706110294771439e1c7d774b0bcc5af3e5b379014"
    },
    {
      "path": "./skills/create-coffee-chat/references/method.md",
      "digest": "sha256:80b3f9ccfda3de337f834c971610ec916c3b5e949623054f36927f67bbabde7f"
    },
    {
      "path": "./skills/create-coffee-chat/references/release.json",
      "digest": "sha256:6171dbb9adc06bc901a29132951f5ed899e66ff76c7b0ca4889a229570dbb8d0"
    }
  ]
}
